{
  "schemaVersion": 1,
  "libraryId": "would_you_rather_v1",
  "title": "Would You Rather",
  "locale": "en-US",
  "origin": {
    "type": "original_kinplay_editorial_work",
    "statement": "Original KinPlay editorial work; no external prompt collection was used or copied."
  },
  "categories": [
    {
      "id": "cute_silly",
      "title": "Cute & Silly",
      "order": 1,
      "prompts": [
        {
          "id": "wyr_cute_silly_001",
          "text": "Would you rather wear a cape covered in tiny bells or wear boots that squeak hello?",
          "status": "approved"
        },
        {
          "id": "wyr_cute_silly_002",
          "text": "Would you rather wear a cape covered in tiny bells or wear a crown made of paper daisies?",
          "status": "approved"
        },
        {
          "id": "wyr_cute_silly_003",
          "text": "Would you rather wear a cape covered in tiny bells or wear socks with dancing stripes?",
          "status": "approved"
        },
        {
          "id": "wyr_cute_silly_004",
          "text": "Would you rather wear a cape covered in tiny bells or wear a belt with three soft pompoms?",
          "status": "approved"
        },
        {
          "id": "wyr_cute_silly_005",
          "text": "Would you rather wear a hat shaped as a sleepy moon or wear boots that squeak hello?",
          "status": "approved"
        },
        {
          "id": "wyr_cute_silly_006",
          "text": "Would you rather wear a hat shaped as a sleepy moon or wear a crown made of paper daisies?",
          "status": "approved"
        },
        {
          "id": "wyr_cute_silly_007",
          "text": "Would you rather wear a hat shaped as a sleepy moon or wear socks with dancing stripes?",
          "status": "approved"
        },
        {
          "id": "wyr_cute_silly_008",
          "text": "Would you rather wear a hat shaped as a sleepy moon or wear a belt with three soft pompoms?",
          "status": "approved"
        },
        {
          "id": "wyr_cute_silly_009",
          "text": "Would you rather wear mittens with wiggly ribbons or wear boots that squeak hello?",
          "status": "approved"
        },
        {
          "id": "wyr_cute_silly_010",
          "text": "Would you rather wear mittens with wiggly ribbons or wear a crown made of paper daisies?",
          "status": "approved"
        },
        {
          "id": "wyr_cute_silly_011",
          "text": "Would you rather wear mittens with wiggly ribbons or wear socks with dancing stripes?",
          "status": "approved"
        },
        {
          "id": "wyr_cute_silly_012",
          "text": "Would you rather wear mittens with wiggly ribbons or wear a belt with three soft pompoms?",
          "status": "approved"
        },
        {
          "id": "wyr_cute_silly_013",
          "text": "Would you rather wear a jacket dotted with felt stars or wear boots that squeak hello?",
          "status": "approved"
        },
        {
          "id": "wyr_cute_silly_014",
          "text": "Would you rather wear a jacket dotted with felt stars or wear a crown made of paper daisies?",
          "status": "approved"
        },
        {
          "id": "wyr_cute_silly_015",
          "text": "Would you rather wear a jacket dotted with felt stars or wear socks with dancing stripes?",
          "status": "approved"
        },
        {
          "id": "wyr_cute_silly_016",
          "text": "Would you rather wear a jacket dotted with felt stars or wear a belt with three soft pompoms?",
          "status": "approved"
        },
        {
          "id": "wyr_cute_silly_017",
          "text": "Would you rather wear a scarf that curls into spirals or wear boots that squeak hello?",
          "status": "approved"
        },
        {
          "id": "wyr_cute_silly_018",
          "text": "Would you rather wear a scarf that curls into spirals or wear a crown made of paper daisies?",
          "status": "approved"
        },
        {
          "id": "wyr_cute_silly_019",
          "text": "Would you rather wear a scarf that curls into spirals or wear socks with dancing stripes?",
          "status": "approved"
        },
        {
          "id": "wyr_cute_silly_020",
          "text": "Would you rather wear a scarf that curls into spirals or wear a belt with three soft pompoms?",
          "status": "approved"
        },
        {
          "id": "wyr_cute_silly_021",
          "text": "Would you rather ride to breakfast in a bubble wagon or bounce to the kitchen on a marshmallow seat?",
          "status": "approved"
        },
        {
          "id": "wyr_cute_silly_022",
          "text": "Would you rather ride to breakfast in a bubble wagon or roll to the library in a button car?",
          "status": "approved"
        },
        {
          "id": "wyr_cute_silly_023",
          "text": "Would you rather ride to breakfast in a bubble wagon or tiptoe to the porch on springy slippers?",
          "status": "approved"
        },
        {
          "id": "wyr_cute_silly_024",
          "text": "Would you rather ride to breakfast in a bubble wagon or drift to the table in a blanket boat?",
          "status": "approved"
        },
        {
          "id": "wyr_cute_silly_025",
          "text": "Would you rather float to lunch on a cloud pillow or bounce to the kitchen on a marshmallow seat?",
          "status": "approved"
        },
        {
          "id": "wyr_cute_silly_026",
          "text": "Would you rather float to lunch on a cloud pillow or roll to the library in a button car?",
          "status": "approved"
        },
        {
          "id": "wyr_cute_silly_027",
          "text": "Would you rather float to lunch on a cloud pillow or tiptoe to the porch on springy slippers?",
          "status": "approved"
        },
        {
          "id": "wyr_cute_silly_028",
          "text": "Would you rather float to lunch on a cloud pillow or drift to the table in a blanket boat?",
          "status": "approved"
        },
        {
          "id": "wyr_cute_silly_029",
          "text": "Would you rather scoot to the park on a giant leaf or bounce to the kitchen on a marshmallow seat?",
          "status": "approved"
        },
        {
          "id": "wyr_cute_silly_030",
          "text": "Would you rather scoot to the park on a giant leaf or roll to the library in a button car?",
          "status": "approved"
        },
        {
          "id": "wyr_cute_silly_031",
          "text": "Would you rather scoot to the park on a giant leaf or tiptoe to the porch on springy slippers?",
          "status": "approved"
        },
        {
          "id": "wyr_cute_silly_032",
          "text": "Would you rather scoot to the park on a giant leaf or drift to the table in a blanket boat?",
          "status": "approved"
        },
        {
          "id": "wyr_cute_silly_033",
          "text": "Would you rather travel to story time in a teacup cart or bounce to the kitchen on a marshmallow seat?",
          "status": "approved"
        },
        {
          "id": "wyr_cute_silly_034",
          "text": "Would you rather travel to story time in a teacup cart or roll to the library in a button car?",
          "status": "approved"
        },
        {
          "id": "wyr_cute_silly_035",
          "text": "Would you rather travel to story time in a teacup cart or tiptoe to the porch on springy slippers?",
          "status": "approved"
        },
        {
          "id": "wyr_cute_silly_036",
          "text": "Would you rather travel to story time in a teacup cart or drift to the table in a blanket boat?",
          "status": "approved"
        },
        {
          "id": "wyr_cute_silly_037",
          "text": "Would you rather glide to the garden on a paper airplane or bounce to the kitchen on a marshmallow seat?",
          "status": "approved"
        },
        {
          "id": "wyr_cute_silly_038",
          "text": "Would you rather glide to the garden on a paper airplane or roll to the library in a button car?",
          "status": "approved"
        },
        {
          "id": "wyr_cute_silly_039",
          "text": "Would you rather glide to the garden on a paper airplane or tiptoe to the porch on springy slippers?",
          "status": "approved"
        },
        {
          "id": "wyr_cute_silly_040",
          "text": "Would you rather glide to the garden on a paper airplane or drift to the table in a blanket boat?",
          "status": "approved"
        },
        {
          "id": "wyr_cute_silly_041",
          "text": "Would you rather make every sneeze release pretend confetti or make every hop leave a chalk rainbow?",
          "status": "approved"
        },
        {
          "id": "wyr_cute_silly_042",
          "text": "Would you rather make every sneeze release pretend confetti or make every whisper sound as a kazoo?",
          "status": "approved"
        },
        {
          "id": "wyr_cute_silly_043",
          "text": "Would you rather make every sneeze release pretend confetti or make every spin scatter paper hearts?",
          "status": "approved"
        },
        {
          "id": "wyr_cute_silly_044",
          "text": "Would you rather make every sneeze release pretend confetti or make every nod make a toy bell jingle?",
          "status": "approved"
        },
        {
          "id": "wyr_cute_silly_045",
          "text": "Would you rather make every hiccup play a tiny drumbeat or make every hop leave a chalk rainbow?",
          "status": "approved"
        },
        {
          "id": "wyr_cute_silly_046",
          "text": "Would you rather make every hiccup play a tiny drumbeat or make every whisper sound as a kazoo?",
          "status": "approved"
        },
        {
          "id": "wyr_cute_silly_047",
          "text": "Would you rather make every hiccup play a tiny drumbeat or make every spin scatter paper hearts?",